"query","significant","p_value","term_size","query_size","intersection_size","precision","recall","term_id","source","term_name","effective_domain_size","source_order","parents"
"query_1",TRUE,3.21907800163128e-09,6707,2299,920,0.400173988690735,0.137170120769345,"TF:M09898","TF","Factor: Egr-2; motif: GNGRRNGWGKGGGNGGRG",20092,1682,"TF:M00000"
"query_1",TRUE,3.61579191791228e-09,7953,2299,1067,0.464114832535885,0.134163208852006,"TF:M11883_1","TF","Factor: pax-6; motif: NYACGCNTSRNYGCNYN; match class: 1",20092,6599,"TF:M11883"
"query_1",TRUE,4.65610471696127e-09,13729,2299,1716,0.746411483253589,0.124990895185374,"TF:M04515","TF","Factor: E2F-1; motif: WWTGGCGCCAAA",20092,1472,"TF:M00000"
"query_1",TRUE,5.89842168995728e-09,7126,2299,968,0.421052631578947,0.135840583777715,"TF:M10529","TF","Factor: Sp1; motif: RGGGMGGRGSNGGGG",20092,8054,"TF:M00000"
"query_1",TRUE,6.81454308882162e-09,4691,2299,673,0.292735972161809,0.143466211895118,"TF:M00915_1","TF","Factor: AP-2; motif: SNNNCCNCAGGCN; match class: 1",20092,161,"TF:M00915"
"query_1",TRUE,7.27261922811694e-09,3347,2299,504,0.219225750326229,0.150582611293696,"TF:M01587","TF","Factor: FPM315; motif: SRGGGAGGAGGN",20092,2926,"TF:M00000"
"query_1",TRUE,7.82135249734973e-09,8042,2299,1075,0.467594606350587,0.133673215618005,"TF:M00940","TF","Factor: E2F-1; motif: NTTTCGCGCS",20092,1496,"TF:M00000"
"query_1",TRUE,8.10421207635923e-09,7949,2299,1064,0.462809917355372,0.133853314882375,"TF:M10435","TF","Factor: Sp2; motif: GGGGCGGGG",20092,8086,"TF:M00000"
"query_1",TRUE,9.39887151633207e-09,15055,2299,1855,0.806872553284037,0.123214878777815,"TF:M07289","TF","Factor: GKLF; motif: NNNRGGNGNGGSN",20092,3290,"TF:M00000"
"query_1",TRUE,1.09364852309635e-08,8248,2299,1098,0.477598956067856,0.133123181377304,"TF:M07380_1","TF","Factor: E2F-4; motif: NTTTCSCGCC; match class: 1",20092,1557,"TF:M07380"
"query_1",TRUE,1.16672918922376e-08,5314,2299,748,0.325358851674641,0.140760255927738,"TF:M00469","TF","Factor: AP-2alpha; motif: GCCNNNRGS",20092,130,"TF:M00000"
"query_1",TRUE,1.27258562857303e-08,8639,2299,1143,0.497172683775555,0.132306979974534,"TF:M04106_1","TF","Factor: RUNX2; motif: NRACCGCAAACCGCAN; match class: 1",20092,7561,"TF:M04106"
"query_1",TRUE,1.34256912833657e-08,10279,2299,1331,0.578947368421053,0.129487304212472,"TF:M09896","TF","Factor: E2F-7; motif: GRGGCGGGAANNN",20092,1570,"TF:M00000"
"query_1",TRUE,1.37170675427758e-08,5556,2299,777,0.337973031752936,0.139848812095032,"TF:M12140","TF","Factor: Egr-1; motif: NNCRCCCMCGCNN",20092,1668,"TF:M00000"
"query_1",TRUE,1.63049847059713e-08,7968,2299,1064,0.462809917355372,0.133534136546185,"TF:M09970","TF","Factor: KLF3; motif: NNNNNNGGGCGGGGCNNGN",20092,4724,"TF:M00000"
"query_1",TRUE,1.66853625824522e-08,12550,2299,1584,0.688995215311005,0.126215139442231,"TF:M04515_1","TF","Factor: E2F-1; motif: WWTGGCGCCAAA; match class: 1",20092,1473,"TF:M04515"
"query_1",TRUE,1.80839413192469e-08,7613,2299,1022,0.444541104828186,0.134244056219624,"TF:M08523_1","TF","Factor: E2F-1:TBR2; motif: NGGTGNNANGGCGCNNTNNCRNNN; match class: 1",20092,1467,"TF:M08523"
"query_1",TRUE,1.82183466050315e-08,11201,2299,1434,0.623749456285342,0.128024283546112,"TF:M09973","TF","Factor: CPBP; motif: GNNRGGGHGGGGNNGGGRN",20092,966,"TF:M00000"
"query_1",TRUE,1.96644627976815e-08,6905,2299,938,0.408003479773815,0.13584359160029,"TF:M07249","TF","Factor: ctcf; motif: CCNCNAGRKGGCRSTN",20092,1180,"TF:M00000"
"query_1",TRUE,2.21509945694004e-08,13097,2299,1643,0.714658547194432,0.125448576009773,"TF:M12160","TF","Factor: KLF15; motif: RCCMCRCCCMCN",20092,4704,"TF:M00000"
"query_1",TRUE,2.24847854191203e-08,7517,2299,1010,0.439321444106133,0.134362112544898,"TF:M00938","TF","Factor: E2F-1; motif: TTGGCGCGRAANNGNM",20092,1486,"TF:M00000"
"query_1",TRUE,2.34581301570998e-08,6641,2299,906,0.394084384515007,0.136425237163078,"TF:M03978_1","TF","Factor: ETS1; motif: GCCGGAWGTACTTCCGGN; match class: 1",20092,2227,"TF:M03978"
"query_1",TRUE,2.65221051362888e-08,6410,2299,878,0.381905176163549,0.136973478939158,"TF:M08875","TF","Factor: E2F; motif: NNTTTCGCGCN",20092,1602,"TF:M00000"
"query_1",TRUE,3.00430522782559e-08,14002,2299,1740,0.756850804697695,0.124267961719754,"TF:M03876","TF","Factor: Kaiso; motif: GCMGGGRGCRGS",20092,4678,"TF:M00000"
"query_1",TRUE,3.74735849327895e-08,10910,2299,1399,0.60852544584602,0.128230980751604,"TF:M07289_1","TF","Factor: GKLF; motif: NNNRGGNGNGGSN; match class: 1",20092,3291,"TF:M07289"
"query_1",TRUE,3.96984278297944e-08,12103,2299,1532,0.666376685515441,0.126580186730563,"TF:M11058","TF","Factor: Hey1; motif: NGCRCGYGYN",20092,3508,"TF:M00000"
"query_1",TRUE,3.99498756807118e-08,5880,2299,813,0.353632013919095,0.138265306122449,"TF:M12345","TF","Factor: Zbtb37; motif: NYACCGCRNTCACCGCR",20092,9382,"TF:M00000"
"query_1",TRUE,4.55654233390555e-08,12315,2299,1555,0.67638103523271,0.126268777913114,"TF:M02090","TF","Factor: E2F-4; motif: GCGGGAAANA",20092,1558,"TF:M00000"
"query_1",TRUE,5.46197262471272e-08,5541,2299,771,0.33536320139191,0.139144558743909,"TF:M01972","TF","Factor: EGR-1; motif: TGCGTGGGCGK",20092,1644,"TF:M00000"
"query_1",TRUE,6.61245746427783e-08,9754,2299,1266,0.550674206176599,0.129792905474677,"TF:M11022","TF","Factor: IRX2a; motif: ACRYGNNNNACRYGT",20092,4538,"TF:M00000"
"query_1",TRUE,6.65441603757623e-08,7174,2299,966,0.420182688125272,0.134652913298021,"TF:M09834","TF","Factor: ZNF148; motif: NNNNNNCCNNCCCCTCCCCCACCCN",20092,9776,"TF:M00000"
"query_1",TRUE,6.96459071806397e-08,8851,2299,1162,0.505437146585472,0.131284600610101,"TF:M12593","TF","Factor: CTCF; motif: NNRSYGCCMCCTGSTGGCCN",20092,1174,"TF:M00000"
"query_1",TRUE,7.97756998880001e-08,5460,2299,760,0.330578512396694,0.139194139194139,"TF:M09658","TF","Factor: Sp2; motif: GGSNNGGGGGCGGGGCCNGNGS",20092,8084,"TF:M00000"
"query_1",TRUE,8.04231214834535e-08,6590,2299,896,0.389734667246629,0.135963581183612,"TF:M07395_1","TF","Factor: Sp1; motif: NGGGGCGGGGN; match class: 1",20092,8065,"TF:M07395"
"query_1",TRUE,8.15414671821825e-08,10234,2299,1320,0.574162679425837,0.128981825288255,"TF:M11478","TF","Factor: AP-2beta; motif: NSCCNNNGGSN",20092,8804,"TF:M00000"
"query_1",TRUE,8.73656297274532e-08,8435,2299,1113,0.484123531970422,0.13195020746888,"TF:M07040_1","TF","Factor: GKLF; motif: NNRRGRRNGNSNNN; match class: 1",20092,3289,"TF:M07040"
"query_1",TRUE,9.51513412604328e-08,8060,2299,1069,0.464984775989561,0.132630272952854,"TF:M09895","TF","Factor: E2F-6; motif: NGGGCGGGARRNN",20092,1564,"TF:M00000"
"query_1",TRUE,1.25373818051515e-07,6001,2299,824,0.358416702914311,0.137310448258624,"TF:M00426_1","TF","Factor: E2F; motif: TTTSGCGS; match class: 1",20092,1597,"TF:M00426"
"query_1",TRUE,1.26250117179256e-07,8188,2299,1083,0.471074380165289,0.132266731802638,"TF:M01303","TF","Factor: SP1; motif: GGGGYGGGGNS",20092,8040,"TF:M00000"
"query_1",TRUE,1.63971485297055e-07,2770,2299,422,0.183558068725533,0.152346570397112,"TF:M10107_1","TF","Factor: DB1; motif: GGRRRRGRRGGAGGGGGNGRRR; match class: 1",20092,1227,"TF:M10107"
"query_1",TRUE,1.70920803021869e-07,13118,2299,1639,0.712918660287081,0.124942826650404,"TF:M13124","TF","Factor: ZNF670; motif: SNGGGCRGRG",20092,11252,"TF:M00000"
"query_1",TRUE,1.91428626693096e-07,16651,2299,2012,0.875163114397564,0.120833583568554,"TF:M10438","TF","Factor: ZF5; motif: GGSGCGCGS",20092,9478,"TF:M00000"
"query_1",TRUE,1.97115832843168e-07,9900,2299,1279,0.556328838625489,0.129191919191919,"TF:M00915","TF","Factor: AP-2; motif: SNNNCCNCAGGCN",20092,160,"TF:M00000"
"query_1",TRUE,1.98188664414048e-07,8795,2299,1152,0.501087429317094,0.130983513359864,"TF:M13142","TF","Factor: ZBTB33; motif: GGYGCTG",20092,9376,"TF:M00000"
"query_1",TRUE,1.99462841061919e-07,11342,2299,1442,0.627229230100043,0.127138070886969,"TF:M12590","TF","Factor: CP2; motif: NRRRCCGGCYNRARCCGGNN",20092,8888,"TF:M00000"
"query_1",TRUE,2.16659004702815e-07,2729,2299,416,0.180948238364506,0.152436790032979,"TF:M10111","TF","Factor: ZF5; motif: NGAGCGCGC",20092,9476,"TF:M00000"
"query_1",TRUE,2.64243807111579e-07,7035,2299,945,0.411048281861679,0.134328358208955,"TF:M07615","TF","Factor: Sp3; motif: GGGGCGGGGSNN",20092,8106,"TF:M00000"
"query_1",TRUE,2.97551891798703e-07,6433,2299,873,0.379730317529361,0.135706513290844,"TF:M11022_1","TF","Factor: IRX2a; motif: ACRYGNNNNACRYGT; match class: 1",20092,4539,"TF:M11022"
"query_1",TRUE,3.13606613955947e-07,4223,2299,604,0.262722923010004,0.143026284631778,"TF:M04953_1","TF","Factor: Sp1; motif: GGNDGGRGGCGGGG; match class: 1",20092,8047,"TF:M04953"
"query_1",TRUE,3.23067156659234e-07,1847,2299,299,0.130056546324489,0.161884136437466,"TF:M12345_1","TF","Factor: Zbtb37; motif: NYACCGCRNTCACCGCR; match class: 1",20092,9383,"TF:M12345"
"query_1",TRUE,3.65191521063461e-07,10667,2299,1364,0.593301435406699,0.127871004031124,"TF:M00736","TF","Factor: E2F-1:DP-1; motif: TTTCSCGC",20092,1460,"TF:M00000"
"query_1",TRUE,4.04102046852489e-07,8540,2299,1120,0.487168334058286,0.131147540983607,"TF:M07226","TF","Factor: SP1; motif: NCCCCKCCCCC",20092,8048,"TF:M00000"
"query_1",TRUE,4.18994685421541e-07,5264,2299,731,0.317964332318399,0.138867781155015,"TF:M04797","TF","Factor: Egr-1; motif: CCGCCCMCG",20092,1648,"TF:M00000"
"query_1",TRUE,4.33585566195874e-07,4538,2299,642,0.279251848629839,0.141472014103129,"TF:M10432_1","TF","Factor: MAZ; motif: GGGMGGGGS; match class: 1",20092,5151,"TF:M10432"
"query_1",TRUE,4.33620022151438e-07,11410,2299,1447,0.629404088734232,0.126818580192813,"TF:M00425","TF","Factor: E2F; motif: TTTCGCGC",20092,1592,"TF:M00000"
"query_1",TRUE,4.39891161573516e-07,5364,2299,743,0.323183993040452,0.138516032811335,"TF:M00933_1","TF","Factor: Sp1; motif: CCCCGCCCCN; match class: 1",20092,8063,"TF:M00933"
"query_1",TRUE,4.75756771010309e-07,4874,2299,683,0.297085689430187,0.140131308986459,"TF:M12704_1","TF","Factor: ZNF432; motif: NCAGNRCCNSRGRCAGC; match class: 1",20092,10537,"TF:M12704"
"query_1",TRUE,5.51930769676148e-07,4788,2299,672,0.292301000434972,0.140350877192982,"TF:M00736_1","TF","Factor: E2F-1:DP-1; motif: TTTCSCGC; match class: 1",20092,1461,"TF:M00736"
"query_1",TRUE,6.11575385081e-07,5728,2299,786,0.341887777294476,0.137220670391061,"TF:M05327","TF","Factor: WT1; motif: NGCGGGGGGGTSMMCYN",20092,9216,"TF:M00000"
"query_1",TRUE,6.80159739924129e-07,15883,2299,1930,0.839495432796868,0.12151356796575,"TF:M08207_1","TF","Factor: E2F-3:TBR2; motif: ANGTGYKANGGCGCSTTNNCRNNT; match class: 1",20092,1515,"TF:M08207"
"query_1",TRUE,6.860213783119e-07,13049,2299,1627,0.707698999565028,0.124683883822515,"TF:M07040","TF","Factor: GKLF; motif: NNRRGRRNGNSNNN",20092,3288,"TF:M00000"
"query_1",TRUE,7.31951767630303e-07,2314,2299,359,0.156154849934754,0.15514261019879,"TF:M12508_1","TF","Factor: EGR1; motif: NNMCGCCCACGCNN; match class: 1",20092,1671,"TF:M12508"
"query_1",TRUE,8.55763244807838e-07,13827,2299,1711,0.7442366246194,0.123743400593043,"TF:M11530_1","TF","Factor: E2F-2; motif: NWTTTGGCGCCAWWNN; match class: 1",20092,1509,"TF:M11530"
"query_1",TRUE,9.62287844675505e-07,8265,2299,1085,0.471944323618965,0.131276467029643,"TF:M11478_1","TF","Factor: AP-2beta; motif: NSCCNNNGGSN; match class: 1",20092,8805,"TF:M11478"
"query_1",TRUE,1.02808251892849e-06,8879,2299,1156,0.502827316224445,0.13019484176146,"TF:M05439","TF","Factor: RREB-1; motif: GGGWCSA",20092,7548,"TF:M00000"
"query_1",TRUE,1.03974304736243e-06,16800,2299,2023,0.87994780339278,0.120416666666667,"TF:M07039","TF","Factor: ETF; motif: CCCCGCCCCYN",20092,2222,"TF:M00000"
"query_1",TRUE,1.11299421906636e-06,6127,2299,832,0.361896476729013,0.135792394320222,"TF:M00931_1","TF","Factor: Sp1; motif: GGGGCGGGGC; match class: 1",20092,8073,"TF:M00931"
"query_1",TRUE,1.34938129491711e-06,7421,2299,985,0.428447150935189,0.132731437811616,"TF:M08874","TF","Factor: E2F1; motif: NNNNNGCGSSAAAN",20092,1492,"TF:M00000"
"query_1",TRUE,1.38000747231397e-06,14026,2299,1731,0.752936059156155,0.123413660345073,"TF:M07039_1","TF","Factor: ETF; motif: CCCCGCCCCYN; match class: 1",20092,2223,"TF:M07039"
"query_1",TRUE,1.3983753275445e-06,5337,2299,736,0.320139190952588,0.13790519018175,"TF:M09761","TF","Factor: EGR1; motif: NGNGKGGGYGGNGS",20092,1662,"TF:M00000"
"query_1",TRUE,1.40512769726183e-06,5759,2299,787,0.342322749021314,0.136655669387046,"TF:M00470_1","TF","Factor: AP-2gamma; motif: GCCYNNGGS; match class: 1",20092,143,"TF:M00470"
"query_1",TRUE,1.72620222292737e-06,4232,2299,600,0.260983036102653,0.141776937618147,"TF:M05432","TF","Factor: ZSCAN18; motif: TRRCGRCGNMCC",20092,11950,"TF:M00000"
"query_1",TRUE,1.73583913623198e-06,8800,2299,1145,0.49804262722923,0.130113636363636,"TF:M04863_1","TF","Factor: TF3C-beta; motif: CCNGGAGGGCTTCCTGGAGGAG; match class: 1",20092,3427,"TF:M04863"
"query_1",TRUE,1.7531353338599e-06,15879,2299,1927,0.838190517616355,0.1213552490711,"TF:M11882","TF","Factor: pax-6; motif: NYACGCNYSANYGMNCN",20092,6596,"TF:M00000"
"query_1",TRUE,2.10160850717971e-06,4806,2299,670,0.291431056981296,0.139409071993342,"TF:M09603","TF","Factor: Egr-1; motif: NNNNNGYGKGGGNGGGNN",20092,1660,"TF:M00000"
"query_1",TRUE,2.29968212121915e-06,2236,2299,346,0.150500217485863,0.15474060822898,"TF:M07141","TF","Factor: FPM315; motif: GGAGGAGGRRGRGGRGGRRGR",20092,10074,"TF:M00000"
"query_1",TRUE,2.54201649839142e-06,5651,2299,772,0.335798173118747,0.136612988851531,"TF:M11541_1","TF","Factor: Foxn2; motif: NNGCGTCNNNNNGACGCNN; match class: 1",20092,2801,"TF:M11541"
"query_1",TRUE,2.65072039734819e-06,7085,2299,943,0.410178338408003,0.133098094565984,"TF:M12464","TF","Factor: ZNF148; motif: NNCCCCTCCCCC",20092,9778,"TF:M00000"
"query_1",TRUE,2.94703232758625e-06,6860,2299,916,0.398434101783384,0.133527696793003,"TF:M09973_1","TF","Factor: CPBP; motif: GNNRGGGHGGGGNNGGGRN; match class: 1",20092,967,"TF:M09973"
"query_1",TRUE,3.0194109338114e-06,17373,2299,2078,0.903871248368856,0.119610890462211,"TF:M11018","TF","Factor: IRX-1; motif: NACRYNNNNNNNNRYGNN",20092,4528,"TF:M00000"
"query_1",TRUE,3.0996267047493e-06,7378,2299,977,0.424967377120487,0.132420710219572,"TF:M07397","TF","Factor: ZBP89; motif: CCCCKCCCCCNN",20092,9314,"TF:M00000"
"query_1",TRUE,3.38526223969543e-06,8769,2299,1139,0.495432796868204,0.12988938305394,"TF:M07277","TF","Factor: BTEB2; motif: RGGGNGKGGN",20092,640,"TF:M00000"
"query_1",TRUE,3.49962133865852e-06,4355,2299,613,0.266637668551544,0.140757749712974,"TF:M01865_1","TF","Factor: BTEB3; motif: BNRNGGGAGGNGT; match class: 1",20092,653,"TF:M01865"
"query_1",TRUE,3.55310106255857e-06,5760,2299,784,0.3410178338408,0.136111111111111,"TF:M00739","TF","Factor: E2F-4:DP-2; motif: TTTCSCGC",20092,1540,"TF:M00000"
"query_1",TRUE,3.78056604993997e-06,4284,2299,604,0.262722923010004,0.140989729225023,"TF:M01072","TF","Factor: HIC1; motif: NSNNNNTGCCCSSNN",20092,3532,"TF:M00000"
"query_1",TRUE,3.78384174421637e-06,9284,2299,1198,0.521096128751631,0.129039207238259,"TF:M10086","TF","Factor: TAFII250; motif: RARRWGGCGGMGGNGR",20092,8392,"TF:M00000"
"query_1",TRUE,4.74299363689674e-06,5918,2299,802,0.34884732492388,0.1355187563366,"TF:M11541","TF","Factor: Foxn2; motif: NNGCGTCNNNNNGACGCNN",20092,2800,"TF:M00000"
"query_1",TRUE,4.81588963888432e-06,5313,2299,729,0.317094388864724,0.137210615471485,"TF:M03814","TF","Factor: BTEB2; motif: GNAGGGGGNGGGSSNN",20092,638,"TF:M00000"
"query_1",TRUE,5.01828446425756e-06,3735,2299,535,0.232709873858199,0.143239625167336,"TF:M01253","TF","Factor: CNOT3; motif: GGCCGCGSSS",20092,934,"TF:M00000"
"query_1",TRUE,5.54444763256949e-06,1865,2299,295,0.128316659417138,0.158176943699732,"TF:M12086","TF","Factor: ZNF501; motif: NNGCGACGCGAACAN",20092,10736,"TF:M00000"
"query_1",TRUE,5.71746253928598e-06,13132,2299,1629,0.708568943018704,0.124048126713372,"TF:M13128","TF","Factor: MED8; motif: CYYNSCYYCCTSCNCC",20092,5170,"TF:M00000"
"query_1",TRUE,5.92060645151877e-06,9813,2299,1257,0.546759460635059,0.128095383674717,"TF:M00427","TF","Factor: E2F; motif: TTTSGCGS",20092,1604,"TF:M00000"
"query_1",TRUE,6.23429462028816e-06,2962,2299,437,0.190082644628099,0.147535449020932,"TF:M12461","TF","Factor: ZBTB14; motif: SSCCGCGCACNS",20092,9340,"TF:M00000"
"query_1",TRUE,6.38990368201928e-06,2673,2299,400,0.173988690735102,0.149644594089039,"TF:M00938_1","TF","Factor: E2F-1; motif: TTGGCGCGRAANNGNM; match class: 1",20092,1487,"TF:M00938"
"query_1",TRUE,6.53282585733042e-06,4697,2299,653,0.284036537625054,0.139024909516713,"TF:M09896_1","TF","Factor: E2F-7; motif: GRGGCGGGAANNN; match class: 1",20092,1571,"TF:M09896"
"query_1",TRUE,6.76049489957739e-06,14370,2299,1763,0.766855154414963,0.122686151704941,"TF:M11417_1","TF","Factor: c-Ets-2; motif: NACCGGAAGYRCTTCCGGTN; match class: 1",20092,2239,"TF:M11417"
"query_1",TRUE,7.12226851770924e-06,2613,2299,392,0.1705089169204,0.150019135093762,"TF:M07329_1","TF","Factor: Osx; motif: CCNCCCCCNNN; match class: 1",20092,6401,"TF:M07329"
"query_1",TRUE,7.13842080092719e-06,17263,2299,2065,0.898216615919965,0.119619996524358,"TF:M08526","TF","Factor: E2F-3:HES-7; motif: NNNSGCGCSNNNNNCRCGYGNN",20092,1520,"TF:M00000"
"query_1",TRUE,7.21022639775268e-06,5722,2299,777,0.337973031752936,0.135791681230339,"TF:M04950_1","TF","Factor: Egr-1; motif: NGCGTGCGY; match class: 1",20092,1655,"TF:M04950"
"query_1",TRUE,7.48234500071968e-06,13104,2299,1625,0.706829056111353,0.124007936507937,"TF:M08441_1","TF","Factor: AP-2gamma:Elk-1; motif: NGCCKNRGGSGRCGGAAGTG; match class: 1",20092,8815,"TF:M08441"
"query_1",TRUE,7.59013435586253e-06,17616,2299,2100,0.913440626359287,0.119209809264305,"TF:M12599","TF","Factor: E2F4; motif: YCCCGCCNCNNSSNNSNN",20092,1554,"TF:M00000"
"query_1",TRUE,8.94650831969543e-06,14667,2299,1794,0.780339277946933,0.122315401922684,"TF:M11417","TF","Factor: c-Ets-2; motif: NACCGGAAGYRCTTCCGGTN",20092,2238,"TF:M00000"
"query_1",TRUE,9.26240365605124e-06,3446,2299,497,0.216180948238365,0.144225188624492,"TF:M13142_1","TF","Factor: ZBTB33; motif: GGYGCTG; match class: 1",20092,9377,"TF:M13142"
"query_1",TRUE,9.509963965537e-06,7336,2299,968,0.421052631578947,0.131952017448201,"TF:M11881_1","TF","Factor: pax-6; motif: NYACGCNTSANYGCNYN; match class: 1",20092,6595,"TF:M11881"
"query_1",TRUE,9.77717404424158e-06,2187,2299,336,0.146150500217486,0.15363511659808,"TF:M03896_1","TF","Factor: EGR1; motif: NACGCCCACGCANW; match class: 1",20092,1647,"TF:M03896"
"query_1",TRUE,1.01653725310972e-05,6678,2299,890,0.387124836885602,0.133273435160228,"TF:M02281","TF","Factor: SP1; motif: CCCCKCCCCC",20092,8042,"TF:M00000"
"query_1",TRUE,1.0705704214019e-05,6899,2299,916,0.398434101783384,0.1327728656327,"TF:M11482","TF","Factor: AP-2gamma; motif: NSCCYNNRGSN",20092,8838,"TF:M00000"
"query_1",TRUE,1.15166531086955e-05,15644,2299,1897,0.825141365811222,0.121260547174636,"TF:M04826_1","TF","Factor: p300; motif: ACNTCCG; match class: 1",20092,1995,"TF:M04826"
"query_1",TRUE,1.17482528886059e-05,10318,2299,1312,0.570682905611135,0.127156425663888,"TF:M12704","TF","Factor: ZNF432; motif: NCAGNRCCNSRGRCAGC",20092,10536,"TF:M00000"
"query_1",TRUE,1.19653225947582e-05,5612,2299,762,0.33144845585037,0.135780470420527,"TF:M01837","TF","Factor: FKLF; motif: BGGGNGGVMD",20092,2496,"TF:M00000"
"query_1",TRUE,1.19698795723401e-05,10742,2299,1360,0.591561548499348,0.126605846211134,"TF:M00740","TF","Factor: Rb:E2F-1:DP-1; motif: TTTSGCGC",20092,1458,"TF:M00000"
"query_1",TRUE,1.24212435312717e-05,9610,2299,1231,0.535450195737277,0.128095733610822,"TF:M00649","TF","Factor: MAZ; motif: GGGGAGGG",20092,5156,"TF:M00000"
"query_1",TRUE,1.2686454050748e-05,8045,2299,1050,0.456720313179643,0.130515848353014,"TF:M13128_1","TF","Factor: MED8; motif: CYYNSCYYCCTSCNCC; match class: 1",20092,5171,"TF:M13128"
"query_1",TRUE,1.44436228547745e-05,15206,2299,1850,0.804697694649848,0.121662501644088,"TF:M11601","TF","Factor: TCF-1; motif: ACATCGRGRCGCTGW",20092,8628,"TF:M00000"
"query_1",TRUE,1.50038731294504e-05,9529,2299,1221,0.5311004784689,0.128135166334348,"TF:M04110","TF","Factor: RUNX3; motif: NRACCGCANWAACCRCAN",20092,7576,"TF:M00000"
"query_1",TRUE,1.53305018618873e-05,7368,2299,970,0.421922575032623,0.131650380021716,"TF:M02023","TF","Factor: MAZ; motif: NKGGGAGGGGRGGR",20092,5158,"TF:M00000"
"query_1",TRUE,1.5765951266459e-05,8301,2299,1079,0.469334493257938,0.129984339236237,"TF:M07348","TF","Factor: AP-2alpha; motif: NSCCNCRGGSN",20092,136,"TF:M00000"
"query_1",TRUE,1.62920740322195e-05,4119,2299,579,0.25184862983906,0.140568099053168,"TF:M00738_1","TF","Factor: E2F-4:DP-1; motif: TTTSGCGC; match class: 1",20092,1539,"TF:M00738"
"query_1",TRUE,1.65330632578127e-05,3412,2299,491,0.213571117877338,0.14390386869871,"TF:M00469_1","TF","Factor: AP-2alpha; motif: GCCNNNRGS; match class: 1",20092,131,"TF:M00469"
"query_1",TRUE,1.77014177837928e-05,11216,2299,1412,0.614180078294911,0.125891583452211,"TF:M12354","TF","Factor: ZNF37A; motif: CCYYGGCTCCNTSCCMN",20092,10394,"TF:M00000"
"query_1",TRUE,1.95329430298218e-05,17527,2299,2089,0.908655937364071,0.119187539225195,"TF:M08525","TF","Factor: E2F-1:HES-7; motif: GGCRCGTGSYNNWNGGCGCSM",20092,1470,"TF:M00000"
"query_1",TRUE,2.02880012107057e-05,12249,2299,1527,0.664201826881253,0.124663237815332,"TF:M00426","TF","Factor: E2F; motif: TTTSGCGS",20092,1596,"TF:M00000"
"query_1",TRUE,2.04561559716831e-05,11729,2299,1469,0.638973466724663,0.125245118935971,"TF:M04516","TF","Factor: E2F-1; motif: TTTGGCGCCAAA",20092,1474,"TF:M00000"
"query_1",TRUE,2.10452120451102e-05,6473,2299,863,0.375380600260983,0.13332303414182,"TF:M07063","TF","Factor: Sp1; motif: GGGGCGGGGC",20092,8066,"TF:M00000"
"query_1",TRUE,2.1215490950808e-05,5264,2299,718,0.312309699869508,0.136398176291793,"TF:M12694_1","TF","Factor: ZFP14; motif: SCNNYCCNGNNSCTSCNC; match class: 1",20092,9499,"TF:M12694"
"query_1",TRUE,2.28887851637989e-05,6274,2299,839,0.364941278816877,0.133726490277335,"TF:M00932_1","TF","Factor: Sp1; motif: NNGGGGCGGGGNN; match class: 1",20092,8069,"TF:M00932"
"query_1",TRUE,2.46980551782945e-05,16674,2299,2002,0.870813397129187,0.120067170445004,"TF:M09636","TF","Factor: MAZ; motif: GGGMGGGGSSGGGGGGGGGGGG",20092,5146,"TF:M00000"
"query_1",TRUE,2.51536736963812e-05,2820,2299,415,0.180513266637669,0.147163120567376,"TF:M09895_1","TF","Factor: E2F-6; motif: NGGGCGGGARRNN; match class: 1",20092,1565,"TF:M09895"
"query_1",TRUE,2.71297355688366e-05,1022,2299,177,0.0769899956502827,0.173189823874755,"TF:M12697_1","TF","Factor: ZNF142; motif: SNSCGCCCGCCCGCSCSS; match class: 1",20092,9773,"TF:M12697"
"query_1",TRUE,2.83010934347881e-05,860,2299,154,0.0669856459330144,0.17906976744186,"TF:M05432_1","TF","Factor: ZSCAN18; motif: TRRCGRCGNMCC; match class: 1",20092,11951,"TF:M05432"
"query_1",TRUE,2.96910617586797e-05,8978,2299,1155,0.502392344497608,0.128647805747382,"TF:M00737","TF","Factor: E2F-1:DP-2; motif: TTTSSCGC",20092,1462,"TF:M00000"
"query_1",TRUE,3.1296773272469e-05,2087,2299,320,0.139190952588082,0.153330138955438,"TF:M03899","TF","Factor: EGR4; motif: NNMCGCCCACGCANNN",20092,1706,"TF:M00000"
"query_1",TRUE,3.22463122023556e-05,6142,2299,822,0.357546759460635,0.133832627808531,"TF:M00196_1","TF","Factor: Sp1; motif: NGGGGGCGGGGYN; match class: 1",20092,8071,"TF:M00196"
"query_1",TRUE,3.35450999762724e-05,4791,2299,659,0.286646367986081,0.137549572114381,"TF:M10071_1","TF","Factor: Sp1; motif: NGGGGGCGGGGCCNGGGGGGGG; match class: 1",20092,8053,"TF:M10071"
"query_1",TRUE,3.39357606033543e-05,10292,2299,1305,0.567638103523271,0.12679751263117,"TF:M04148","TF","Factor: TFAP2A; motif: NGCCCYNNGGGCN",20092,8782,"TF:M00000"
"query_1",TRUE,3.42211587141194e-05,6035,2299,809,0.351892127011744,0.134051367025684,"TF:M12313","TF","Factor: ZNF460; motif: NNACNCCCCCCNN",20092,10648,"TF:M00000"
"query_1",TRUE,3.51520787697696e-05,2859,2299,419,0.18225315354502,0.146554739419377,"TF:M12535","TF","Factor: ZNF263; motif: NNGGGGAGGANN",20092,10080,"TF:M00000"
"query_1",TRUE,3.75261159811376e-05,9490,2299,1213,0.527620704654198,0.12781875658588,"TF:M03895","TF","Factor: CTCF; motif: WGCGCCMYCTAGYGGYN",20092,1154,"TF:M00000"
"query_1",TRUE,4.24796393996972e-05,7520,2299,984,0.428012179208351,0.130851063829787,"TF:M01175","TF","Factor: CKROX; motif: SCCCTCCCC",20092,872,"TF:M00000"
"query_1",TRUE,5.24369978818665e-05,7280,2299,955,0.415397999130057,0.131181318681319,"TF:M10098","TF","Factor: DP-1; motif: NRNNGGCGGGAANN",20092,8892,"TF:M00000"
"query_1",TRUE,5.53271188875101e-05,2712,2299,399,0.173553719008264,0.14712389380531,"TF:M00940_1","TF","Factor: E2F-1; motif: NTTTCGCGCS; match class: 1",20092,1497,"TF:M00940"
"query_1",TRUE,6.30064400769298e-05,10551,2299,1332,0.57938234014789,0.126243957918681,"TF:M04516_1","TF","Factor: E2F-1; motif: TTTGGCGCCAAA; match class: 1",20092,1475,"TF:M04516"
"query_1",TRUE,6.63334589407353e-05,10113,2299,1282,0.557633753806003,0.126767526945516,"TF:M00738","TF","Factor: E2F-4:DP-1; motif: TTTSGCGC",20092,1538,"TF:M00000"
"query_1",TRUE,6.8170728944742e-05,2890,2299,421,0.183123096998695,0.145674740484429,"TF:M01118_1","TF","Factor: WT1; motif: SMCNCCNSC; match class: 1",20092,9223,"TF:M01118"
"query_1",TRUE,6.90535328349091e-05,11556,2299,1445,0.628534145280557,0.125043267566632,"TF:M03971","TF","Factor: ELK1; motif: NACTTCCGSCGGAAGYN",20092,1894,"TF:M00000"
"query_1",TRUE,7.50166611318372e-05,5384,2299,728,0.316659417137886,0.135215453194651,"TF:M12057","TF","Factor: ZBP99; motif: GCCCMTCCCCCR",20092,9528,"TF:M00000"
"query_1",TRUE,7.87761117341848e-05,4520,2299,623,0.270987385819922,0.13783185840708,"TF:M12648","TF","Factor: PATZ1; motif: SCNCCNCNSCCCCCASCCN",20092,6502,"TF:M00000"
"query_1",TRUE,8.24028108213269e-05,6634,2299,877,0.381470204436712,0.132197769068435,"TF:M04107_1","TF","Factor: RUNX2; motif: WRACCGCANWAACCGCAN; match class: 1",20092,7563,"TF:M04107"
"query_1",TRUE,8.38369737338283e-05,2230,2299,336,0.146150500217486,0.15067264573991,"TF:M08874_1","TF","Factor: E2F1; motif: NNNNNGCGSSAAAN; match class: 1",20092,1493,"TF:M08874"
"query_1",TRUE,8.51065212272887e-05,3141,2299,452,0.196607220530666,0.143903215536453,"TF:M03806","TF","Factor: ZBTB7C; motif: GKCCCGGGCKG",20092,9454,"TF:M00000"
