"query","significant","p_value","term_size","query_size","intersection_size","precision","recall","term_id","source","term_name","effective_domain_size","source_order","parents"
"query_1",TRUE,9.41716935041567e-05,8723,2299,1121,0.487603305785124,0.128510833428866,"TF:M12085","TF","Factor: ZNF501; motif: NNNCSACGCGAACAC",20092,10734,"TF:M00000"
"query_1",TRUE,9.9379516646691e-05,10171,2299,1287,0.559808612440191,0.126536230459149,"TF:M11058_1","TF","Factor: Hey1; motif: NGCRCGYGYN; match class: 1",20092,3509,"TF:M11058"
"query_1",TRUE,0.000126288699896668,12509,2299,1549,0.673771204871683,0.123830841793908,"TF:M08523","TF","Factor: E2F-1:TBR2; motif: NGGTGNNANGGCGCNNTNNCRNNN",20092,1466,"TF:M00000"
"query_1",TRUE,0.000140069788653548,9684,2299,1230,0.535015224010439,0.127013630731103,"TF:M00470","TF","Factor: AP-2gamma; motif: GCCYNNGGS",20092,142,"TF:M00000"
"query_1",TRUE,0.000143741130076638,9851,2299,1249,0.543279686820357,0.12678915846107,"TF:M04148_1","TF","Factor: TFAP2A; motif: NGCCCYNNGGGCN; match class: 1",20092,8783,"TF:M04148"
"query_1",TRUE,0.000148233405737951,617,2299,116,0.0504567203131796,0.188006482982172,"TF:M10134_1","TF","Factor: FPM315; motif: GGGAGGAGGRRGRGGRGGRR; match class: 1",20092,2929,"TF:M10134"
"query_1",TRUE,0.000148295406452948,8808,2299,1129,0.491083079599826,0.128178928247048,"TF:M05361","TF","Factor: Sp6; motif: WGGGCGG",20092,8124,"TF:M00000"
"query_1",TRUE,0.000148295406452948,8808,2299,1129,0.491083079599826,0.128178928247048,"TF:M05332","TF","Factor: Sp2; motif: WGGGCGG",20092,8078,"TF:M00000"
"query_1",TRUE,0.000148295406452948,8808,2299,1129,0.491083079599826,0.128178928247048,"TF:M05444","TF","Factor: CPBP; motif: NGGGCGG",20092,964,"TF:M00000"
"query_1",TRUE,0.000150360521952347,8463,2299,1089,0.473684210526316,0.128677773839064,"TF:M10530","TF","Factor: sp4; motif: NNNGCYCCGCCCCCY",20092,8112,"TF:M00000"
"query_1",TRUE,0.000151706765479893,1570,2299,248,0.107872988255763,0.15796178343949,"TF:M12737","TF","Factor: ZNF610; motif: NSCGCCGCTCCSNN",20092,11100,"TF:M00000"
"query_1",TRUE,0.000152820208582341,7120,2299,932,0.405393649412788,0.130898876404494,"TF:M00516","TF","Factor: E2F-1; motif: TTTSGCGCGMNR",20092,1588,"TF:M00000"
"query_1",TRUE,0.000167333638612342,3078,2299,442,0.192257503262288,0.143599740090968,"TF:M12085_1","TF","Factor: ZNF501; motif: NNNCSACGCGAACAC; match class: 1",20092,10735,"TF:M12085"
"query_1",TRUE,0.000174549781052936,6355,2299,841,0.365811222270552,0.132336742722266,"TF:M00244","TF","Factor: NGFI-C; motif: WTGCGTGGGYGG",20092,5940,"TF:M00000"
"query_1",TRUE,0.00018589261646033,8790,2299,1126,0.489778164419313,0.128100113765643,"TF:M09727","TF","Factor: GEMIN3; motif: NCWGGRARRGRGNGNG",20092,3258,"TF:M00000"
"query_1",TRUE,0.000196480134577244,10971,2299,1375,0.598086124401914,0.12533041655273,"TF:M12694","TF","Factor: ZFP14; motif: SCNNYCCNGNNSCTSCNC",20092,9498,"TF:M00000"
"query_1",TRUE,0.000197880902643618,13485,2299,1655,0.719878207916485,0.122728958101594,"TF:M11533","TF","Factor: E2F-1; motif: NTTTTGGCGCCAWWWN",20092,1480,"TF:M00000"
"query_1",TRUE,0.000208066703562449,3944,2299,549,0.238799478033928,0.13919878296146,"TF:M00427_1","TF","Factor: E2F; motif: TTTSGCGS; match class: 1",20092,1605,"TF:M00427"
"query_1",TRUE,0.000222169306463305,8313,2299,1070,0.465419747716398,0.128714062312041,"TF:M12160_1","TF","Factor: KLF15; motif: RCCMCRCCCMCN; match class: 1",20092,4705,"TF:M12160"
"query_1",TRUE,0.000233711505441728,7492,2299,974,0.423662461939974,0.130005339028297,"TF:M00431","TF","Factor: E2F-1; motif: TTTSGCGS",20092,1494,"TF:M00000"
"query_1",TRUE,0.000235658716143262,10783,2299,1353,0.588516746411483,0.125475285171103,"TF:M12158","TF","Factor: KLF15; motif: NCCMCGCCCMCN",20092,4700,"TF:M00000"
"query_1",TRUE,0.000245378653175836,2121,2299,319,0.138755980861244,0.15040075436115,"TF:M11482_1","TF","Factor: AP-2gamma; motif: NSCCYNNRGSN; match class: 1",20092,8839,"TF:M11482"
"query_1",TRUE,0.00025256399091852,3320,2299,471,0.204871683340583,0.141867469879518,"TF:M05439_1","TF","Factor: RREB-1; motif: GGGWCSA; match class: 1",20092,7549,"TF:M05439"
"query_1",TRUE,0.000273051132744898,11774,2299,1464,0.636798608090474,0.124341770001699,"TF:M13132","TF","Factor: ZNF609; motif: GNSNGGGNGCTGN",20092,11096,"TF:M00000"
"query_1",TRUE,0.000294801277351771,6964,2299,911,0.396259243149195,0.130815623205055,"TF:M11490","TF","Factor: LBP-1; motif: NRCCGGTNNNNACCGGYN",20092,4770,"TF:M00000"
"query_1",TRUE,0.000301606483978557,14324,2299,1745,0.759025663331883,0.1218235129852,"TF:M08487","TF","Factor: GCMa:Erg; motif: ATGCGGGCGGAARKG",20092,3158,"TF:M00000"
"query_1",TRUE,0.000446746089315132,18197,2299,2148,0.934319269247499,0.11804143540144,"TF:M04826","TF","Factor: p300; motif: ACNTCCG",20092,1994,"TF:M00000"
"query_1",TRUE,0.000495135563350065,8032,2299,1034,0.449760765550239,0.128735059760956,"TF:M08209_1","TF","Factor: E2F-3:FOXO6; motif: NAATGACACGCGCCCMC; match class: 1",20092,1519,"TF:M08209"
"query_1",TRUE,0.00058903517670853,12348,2299,1525,0.663331883427577,0.123501781665047,"TF:M03978","TF","Factor: ETS1; motif: GCCGGAWGTACTTCCGGN",20092,2226,"TF:M00000"
"query_1",TRUE,0.000675364872216927,14702,2299,1783,0.775554588951718,0.121276016868453,"TF:M08266","TF","Factor: ER71:Pax-5; motif: ACCGGAACYACGCWTSANTG",20092,2306,"TF:M00000"
"query_1",TRUE,0.000729637010496571,4061,2299,559,0.243149195302305,0.13765082491997,"TF:M07226_1","TF","Factor: SP1; motif: NCCCCKCCCCC; match class: 1",20092,8049,"TF:M07226"
"query_1",TRUE,0.000739521033276887,7524,2299,973,0.423227490213136,0.129319510898458,"TF:M00245","TF","Factor: Egr-3; motif: NTGCGTGGGCGK",20092,1692,"TF:M00000"
"query_1",TRUE,0.000799472755720476,1845,2299,280,0.121792083514572,0.151761517615176,"TF:M05327_1","TF","Factor: WT1; motif: NGCGGGGGGGTSMMCYN; match class: 1",20092,9217,"TF:M05327"
"query_1",TRUE,0.000801602862025982,13972,2299,1703,0.740756850804698,0.121886630403664,"TF:M04863","TF","Factor: TF3C-beta; motif: CCNGGAGGGCTTCCTGGAGGAG",20092,3426,"TF:M00000"
"query_1",TRUE,0.00083007173203593,2943,2299,420,0.182688125271857,0.142711518858308,"TF:M10529_1","TF","Factor: Sp1; motif: RGGGMGGRGSNGGGG; match class: 1",20092,8055,"TF:M10529"
"query_1",TRUE,0.00086975584414045,4731,2299,640,0.278381905176164,0.135277953920947,"TF:M00740_1","TF","Factor: Rb:E2F-1:DP-1; motif: TTTSGCGC; match class: 1",20092,1459,"TF:M00740"
"query_1",TRUE,0.000898330007370625,7258,2299,941,0.409308394954328,0.129650041333701,"TF:M08309_1","TF","Factor: GCMa:Elk-1; motif: RTGNGGGCGGAAGNN; match class: 1",20092,3153,"TF:M08309"
"query_1",TRUE,0.000943558161967123,4355,2299,594,0.258373205741627,0.136394948335247,"TF:M03807_1","TF","Factor: SP2; motif: GNNGGGGGCGGGGSN; match class: 1",20092,8097,"TF:M03807"
"query_1",TRUE,0.00116560518142321,11774,2299,1458,0.634188777729448,0.123832172583659,"TF:M11066","TF","Factor: HES-7; motif: GNCACGYGNN",20092,3492,"TF:M00000"
"query_1",TRUE,0.00145374661214713,3731,2299,516,0.224445411048282,0.138300723666577,"TF:M00428_1","TF","Factor: E2F-1; motif: NKTSSCGC; match class: 1",20092,1485,"TF:M00428"
"query_1",TRUE,0.00147630261179327,5512,2299,732,0.318399304045237,0.132801161103048,"TF:M00425_1","TF","Factor: E2F; motif: TTTCGCGC; match class: 1",20092,1593,"TF:M00425"
"query_1",TRUE,0.00149213961789875,7072,2299,917,0.398869073510222,0.12966628959276,"TF:M12183","TF","Factor: KLF14; motif: NRCCACRCCCMCN",20092,4692,"TF:M00000"
"query_1",TRUE,0.0016831168646487,2023,2299,301,0.130926489778164,0.14878892733564,"TF:M08662","TF","Factor: AP-2gamma:HES-7; motif: NNCACGYGNNNNNNSCCNNNGGS",20092,8818,"TF:M00000"
"query_1",TRUE,0.00168760354831506,2304,2299,337,0.146585471944324,0.146267361111111,"TF:M13146_1","TF","Factor: ZNF232; motif: NCAGCASCNNGGNCAGCGCC; match class: 1",20092,9987,"TF:M13146"
"query_1",TRUE,0.00172688007921735,3026,2299,428,0.186167899086559,0.141440846001322,"TF:M00737_1","TF","Factor: E2F-1:DP-2; motif: TTTSSCGC; match class: 1",20092,1463,"TF:M00737"
"query_1",TRUE,0.00187531229106537,5855,2299,772,0.335798173118747,0.131853116994022,"TF:M00920","TF","Factor: E2F; motif: NKCGCGCSAAAN",20092,1606,"TF:M00000"
"query_1",TRUE,0.00222855607778692,3105,2299,437,0.190082644628099,0.140740740740741,"TF:M09760_1","TF","Factor: DPF2; motif: NYCACYTCCYCNYYCY; match class: 1",20092,1391,"TF:M09760"
"query_1",TRUE,0.0022291521169603,8951,2299,1134,0.493257938234015,0.126689755334599,"TF:M12666","TF","Factor: SP1; motif: GGCCCCGCCCCCN",20092,8060,"TF:M00000"
"query_1",TRUE,0.00237694366049706,2265,2299,331,0.143975641583297,0.146136865342163,"TF:M07208_1","TF","Factor: EGR1; motif: NCNCCGCCCCCGCN; match class: 1",20092,1657,"TF:M07208"
"query_1",TRUE,0.00256042359795452,2741,2299,391,0.170073945193562,0.142648668369208,"TF:M07436_1","TF","Factor: WT1; motif: NNGGGNGGGSGN; match class: 1",20092,9221,"TF:M07436"
"query_1",TRUE,0.00270503554433975,915,2299,153,0.0665506742061766,0.167213114754098,"TF:M07141_1","TF","Factor: FPM315; motif: GGAGGAGGRRGRGGRGGRRGR; match class: 1",20092,10075,"TF:M07141"
"query_1",TRUE,0.0027143967326232,5516,2299,730,0.317529360591562,0.132342277012328,"TF:M00243","TF","Factor: Egr-1; motif: WTGCGTGGGCGK",20092,1642,"TF:M00000"
"query_1",TRUE,0.00272817921771673,9228,2299,1165,0.506742061765985,0.126246207195492,"TF:M00428","TF","Factor: E2F-1; motif: NKTSSCGC",20092,1484,"TF:M00000"
"query_1",TRUE,0.00279397555089537,3063,2299,431,0.187472814267073,0.140711720535423,"TF:M09632","TF","Factor: Kaiso; motif: GNTCTCGCGAGRNNNNGGN",20092,9370,"TF:M00000"
"query_1",TRUE,0.00283607729462067,6637,2299,863,0.375380600260983,0.130028627391894,"TF:M00939","TF","Factor: E2F; motif: TTTSGCGSG",20092,1600,"TF:M00000"
"query_1",TRUE,0.00303977621888438,15459,2299,1859,0.808612440191388,0.120253573969856,"TF:M08568_1","TF","Factor: ER71:E2A; motif: CASSTGNACCGGAWRYN; match class: 1",20092,2321,"TF:M08568"
"query_1",TRUE,0.00306223355720983,3867,2299,530,0.23053501522401,0.137057150245668,"TF:M04110_1","TF","Factor: RUNX3; motif: NRACCGCANWAACCRCAN; match class: 1",20092,7577,"TF:M04110"
"query_1",TRUE,0.00341969115687689,6483,2299,844,0.367116137451066,0.130186641986735,"TF:M07129","TF","Factor: Sp2; motif: GYCCCGCCYCYNNNN",20092,8082,"TF:M00000"
"query_1",TRUE,0.00354122011947695,12811,2299,1569,0.682470639408438,0.122472874873156,"TF:M11052","TF","Factor: Hey2; motif: NNCACGYGNN",20092,3516,"TF:M00000"
"query_1",TRUE,0.00365914295378596,13490,2299,1644,0.71509351892127,0.121868050407709,"TF:M11881","TF","Factor: pax-6; motif: NYACGCNTSANYGCNYN",20092,6594,"TF:M00000"
"query_1",TRUE,0.00367152265525127,3620,2299,499,0.21705089169204,0.137845303867403,"TF:M03895_1","TF","Factor: CTCF; motif: WGCGCCMYCTAGYGGYN; match class: 1",20092,1155,"TF:M03895"
"query_1",TRUE,0.00415033623101563,6186,2299,808,0.351457155284907,0.130617523440026,"TF:M11490_1","TF","Factor: LBP-1; motif: NRCCGGTNNNNACCGGYN; match class: 1",20092,4771,"TF:M11490"
"query_1",TRUE,0.00420829974895397,14444,2299,1748,0.760330578512397,0.121019108280255,"TF:M04710","TF","Factor: CHD2; motif: TCTCGCGAG",20092,856,"TF:M00000"
"query_1",TRUE,0.0042976189338012,3910,2299,534,0.232274902131361,0.136572890025575,"TF:M09970_1","TF","Factor: KLF3; motif: NNNNNNGGGCGGGGCNNGN; match class: 1",20092,4725,"TF:M09970"
"query_1",TRUE,0.00436011239584698,2731,2299,388,0.168769030013049,0.142072500915416,"TF:M02105","TF","Factor: NF-E4; motif: CHCCCTCKCCWG",20092,5850,"TF:M00000"
"query_1",TRUE,0.00436318087075628,7787,2299,996,0.433231839930405,0.127905483498138,"TF:M01100","TF","Factor: LRF; motif: GGGGKYNNB",20092,4952,"TF:M00000"
"query_1",TRUE,0.00467414696982449,3037,2299,426,0.185297955632884,0.140270003292723,"TF:M07348_1","TF","Factor: AP-2alpha; motif: NSCCNCRGGSN; match class: 1",20092,137,"TF:M07348"
"query_1",TRUE,0.00485793175841157,7714,2299,987,0.429317094388865,0.127949183303085,"TF:M09765","TF","Factor: SP1; motif: NRGKGGGCGGGGCN",20092,8050,"TF:M00000"
"query_1",TRUE,0.0053747464451939,1289,2299,202,0.0878642888212266,0.156710628394104,"TF:M08440","TF","Factor: AP-2gamma:E2F-8; motif: NTTCCCGCNNSCCCSMGGC",20092,8812,"TF:M00000"
"query_1",TRUE,0.00544075179200614,7530,2299,965,0.419747716398434,0.128154050464807,"TF:M13148","TF","Factor: ZSCAN21; motif: NSNGNSCNNGGTGCTG",20092,9662,"TF:M00000"
"query_1",TRUE,0.0057597396632067,6350,2299,826,0.359286646367986,0.13007874015748,"TF:M00919","TF","Factor: E2F; motif: NCSCGCSAAAN",20092,1598,"TF:M00000"
"query_1",TRUE,0.00592179311041234,11775,2299,1451,0.631143975641583,0.123227176220807,"TF:M04710_1","TF","Factor: CHD2; motif: TCTCGCGAG; match class: 1",20092,857,"TF:M04710"
"query_1",TRUE,0.00603751577387321,5762,2299,756,0.328838625489343,0.13120444290177,"TF:M00918","TF","Factor: E2F; motif: TTTSGCGSG",20092,1594,"TF:M00000"
"query_1",TRUE,0.00618271810530474,4373,2299,589,0.256198347107438,0.134690144065859,"TF:M09897","TF","Factor: Egr-1; motif: NNNNGCGKGGGYGGNRN",20092,1664,"TF:M00000"
"query_1",TRUE,0.00751397398536747,2994,2299,419,0.18225315354502,0.139946559786239,"TF:M09834_1","TF","Factor: ZNF148; motif: NNNNNNCCNNCCCCTCCCCCACCCN; match class: 1",20092,9777,"TF:M09834"
"query_1",TRUE,0.00767009074310962,4010,2299,544,0.236624619399739,0.135660847880299,"TF:M00976","TF","Factor: AhR,; motif: NRCGTGNGN",20092,16,"TF:M00000"
"query_1",TRUE,0.00815765769260876,13376,2299,1628,0.708133971291866,0.121710526315789,"TF:M11880","TF","Factor: pax-6; motif: NYACGCWTSANYGMNCN",20092,6592,"TF:M00000"
"query_1",TRUE,0.00826110246668766,5807,2299,760,0.330578512396694,0.13087652832788,"TF:M12354_1","TF","Factor: ZNF37A; motif: CCYYGGCTCCNTSCCMN; match class: 1",20092,10395,"TF:M12354"
"query_1",TRUE,0.00976112770682777,16494,2299,1965,0.85471944323619,0.11913423062932,"TF:M01886","TF","Factor: NFATc3; motif: GGAAAA",20092,5762,"TF:M00000"
"query_1",TRUE,0.00976112770682777,16494,2299,1965,0.85471944323619,0.11913423062932,"TF:M03555","TF","Factor: NFATc2; motif: GGAAAA",20092,5746,"TF:M00000"
"query_1",TRUE,0.00976112770682777,16494,2299,1965,0.85471944323619,0.11913423062932,"TF:M01281","TF","Factor: NFATc2; motif: GGAAAA",20092,5750,"TF:M00000"
"query_1",TRUE,0.010096347763778,2324,2299,334,0.14528055676381,0.143717728055077,"TF:M00431_1","TF","Factor: E2F-1; motif: TTTSGCGS; match class: 1",20092,1495,"TF:M00431"
"query_1",TRUE,0.0109470028267089,3409,2299,469,0.204001739886907,0.137577002053388,"TF:M09968","TF","Factor: KLF15; motif: RGGGMGGRGNNGGGGGNGG",20092,4696,"TF:M00000"
"query_1",TRUE,0.0116108809629778,1632,2299,245,0.10656807307525,0.150122549019608,"TF:M04797_1","TF","Factor: Egr-1; motif: CCGCCCMCG; match class: 1",20092,1649,"TF:M04797"
"query_1",TRUE,0.0123410980535819,14347,2299,1733,0.75380600260983,0.120791803164425,"TF:M08225","TF","Factor: Elk-1:Pax-5; motif: ACCGGAACYACGCWTSANYG",20092,1868,"TF:M00000"
"query_1",TRUE,0.0127045960969112,3895,2299,528,0.229665071770335,0.135558408215661,"TF:M12516","TF","Factor: E2F6; motif: NNNGGCGGGAANN",20092,1566,"TF:M00000"
"query_1",TRUE,0.0128734169083151,9221,2299,1157,0.503262287951283,0.125474460470665,"TF:M08266_1","TF","Factor: ER71:Pax-5; motif: ACCGGAACYACGCWTSANTG; match class: 1",20092,2307,"TF:M08266"
"query_1",TRUE,0.0136651486490396,10000,2299,1246,0.541974771639843,0.1246,"TF:M04109","TF","Factor: RUNX3; motif: NRACCGCAAACCGCAN",20092,7574,"TF:M00000"
"query_1",TRUE,0.0143455671655137,3727,2299,507,0.220530665506742,0.136034343976389,"TF:M07617","TF","Factor: Sp4; motif: SCCCCKCCCCCSN",20092,8116,"TF:M00000"
"query_1",TRUE,0.0143705195285027,13779,2299,1670,0.726402783819052,0.121198925901735,"TF:M11883","TF","Factor: pax-6; motif: NYACGCNTSRNYGCNYN",20092,6598,"TF:M00000"
"query_1",TRUE,0.0144228895001227,17454,2299,2064,0.897781644193127,0.118253695427982,"TF:M08207","TF","Factor: E2F-3:TBR2; motif: ANGTGYKANGGCGCSTTNNCRNNT",20092,1514,"TF:M00000"
"query_1",TRUE,0.0151100606541224,1630,2299,244,0.106133101348412,0.149693251533742,"TF:M12140_1","TF","Factor: Egr-1; motif: NNCRCCCMCGCNN; match class: 1",20092,1669,"TF:M12140"
"query_1",TRUE,0.015723013824425,8389,2299,1060,0.461070030448021,0.1263559423054,"TF:M09760","TF","Factor: DPF2; motif: NYCACYTCCYCNYYCY",20092,1390,"TF:M00000"
"query_1",TRUE,0.0160194625763781,10375,2299,1288,0.560243584167029,0.124144578313253,"TF:M00008","TF","Factor: Sp1; motif: GGGGCGGGGT",20092,8038,"TF:M00000"
"query_1",TRUE,0.0182020902370155,6343,2299,820,0.35667681600696,0.129276367649377,"TF:M01973","TF","Factor: PLAG1; motif: CCCCCKWNNNGGSCCC",20092,6826,"TF:M00000"
"query_1",TRUE,0.0211408671752969,13967,2299,1689,0.734667246628969,0.120927901482065,"TF:M11393_1","TF","Factor: Erg; motif: NACCGGATATCCGGTN; match class: 1",20092,2089,"TF:M11393"
"query_1",TRUE,0.0211582521040164,2630,2299,370,0.16093953892997,0.140684410646388,"TF:M12464_1","TF","Factor: ZNF148; motif: NNCCCCTCCCCC; match class: 1",20092,9779,"TF:M12464"
"query_1",TRUE,0.0235906583256868,6404,2299,826,0.359286646367986,0.128981886321049,"TF:M00246","TF","Factor: Egr-2; motif: NTGCGTRGGCGK",20092,1676,"TF:M00000"
"query_1",TRUE,0.0250465816877867,12728,2299,1551,0.674641148325359,0.121857322438718,"TF:M04107","TF","Factor: RUNX2; motif: WRACCGCANWAACCGCAN",20092,7562,"TF:M00000"
"query_1",TRUE,0.0290372213169631,3758,2299,508,0.22096563723358,0.135178286322512,"TF:M03567_1","TF","Factor: Sp2; motif: NYSGCCCCGCCCCCY; match class: 1",20092,8095,"TF:M03567"
"query_1",TRUE,0.0297050458005223,1345,2299,205,0.0891692040017399,0.152416356877323,"TF:M03814_1","TF","Factor: BTEB2; motif: GNAGGGGGNGGGSSNN; match class: 1",20092,639,"TF:M03814"
"query_1",TRUE,0.0309572365491152,3670,2299,497,0.216180948238365,0.135422343324251,"TF:M01303_1","TF","Factor: SP1; motif: GGGGYGGGGNS; match class: 1",20092,8041,"TF:M01303"
"query_1",TRUE,0.0313866255338213,11259,2299,1385,0.602435841670291,0.123012700950351,"TF:M01886_1","TF","Factor: NFATc3; motif: GGAAAA; match class: 1",20092,5763,"TF:M01886"
"query_1",TRUE,0.0313866255338213,11259,2299,1385,0.602435841670291,0.123012700950351,"TF:M01281_1","TF","Factor: NFATc2; motif: GGAAAA; match class: 1",20092,5751,"TF:M01281"
"query_1",TRUE,0.0313866255338213,11259,2299,1385,0.602435841670291,0.123012700950351,"TF:M03555_1","TF","Factor: NFATc2; motif: GGAAAA; match class: 1",20092,5747,"TF:M03555"
"query_1",TRUE,0.0378032237995406,3017,2299,416,0.180948238364506,0.137885316539609,"TF:M07615_1","TF","Factor: Sp3; motif: GGGGCGGGGSNN; match class: 1",20092,8107,"TF:M07615"
"query_1",TRUE,0.0398074676554673,3433,2299,467,0.203131796433232,0.136032624526653,"TF:M05332_1","TF","Factor: Sp2; motif: WGGGCGG; match class: 1",20092,8079,"TF:M05332"
"query_1",TRUE,0.0398074676554673,3433,2299,467,0.203131796433232,0.136032624526653,"TF:M05444_1","TF","Factor: CPBP; motif: NGGGCGG; match class: 1",20092,965,"TF:M05444"
"query_1",TRUE,0.0398074676554673,3433,2299,467,0.203131796433232,0.136032624526653,"TF:M05361_1","TF","Factor: Sp6; motif: WGGGCGG; match class: 1",20092,8125,"TF:M05361"
"query_1",TRUE,0.041391244073633,3655,2299,494,0.214876033057851,0.13515731874145,"TF:M10435_1","TF","Factor: Sp2; motif: GGGGCGGGG; match class: 1",20092,8087,"TF:M10435"
"query_1",TRUE,0.041758219623356,4058,2299,543,0.236189647672901,0.133809758501725,"TF:M07042","TF","Factor: HES-1; motif: NNCKYGTGNNN",20092,3472,"TF:M00000"
"query_1",TRUE,0.0422740057278261,3386,2299,461,0.200521966072205,0.136148848198464,"TF:M12604","TF","Factor: EZF2; motif: NNCCNSNSCNMCTCCMYCTT",20092,2446,"TF:M00000"
"query_1",TRUE,0.0439103096283413,9753,2299,1212,0.52718573292736,0.124269455552138,"TF:M11052_1","TF","Factor: Hey2; motif: NNCACGYGNN; match class: 1",20092,3517,"TF:M11052"
