"query","significant","p_value","term_size","query_size","intersection_size","precision","recall","term_id","source","term_name","effective_domain_size","source_order","parents"
"query_1",TRUE,1.32075683599644e-43,7249,2299,1147,0.498912570682906,0.158228721202925,"TF:M00695_1","TF","Factor: ETF; motif: GVGGMGG; match class: 1",20092,2221,"TF:M00695"
"query_1",TRUE,1.00586262692997e-38,10751,2299,1533,0.666811657242279,0.142591386847735,"TF:M00695","TF","Factor: ETF; motif: GVGGMGG",20092,2220,"TF:M00000"
"query_1",TRUE,1.44232939355932e-32,12719,2299,1721,0.748586341887777,0.135309379668213,"TF:M11531_1","TF","Factor: E2F-2; motif: GCGCGCGCGYW; match class: 1",20092,1511,"TF:M11531"
"query_1",TRUE,1.33550942831101e-31,10540,2299,1482,0.644628099173554,0.140607210626186,"TF:M00803_1","TF","Factor: E2F; motif: GGCGSG; match class: 1",20092,1591,"TF:M00803"
"query_1",TRUE,9.93603845914494e-27,9703,2299,1367,0.594606350587212,0.140884262599196,"TF:M13144","TF","Factor: ZNF138; motif: GCAGCRSCNSGSNCMGSGCS",20092,9758,"TF:M00000"
"query_1",TRUE,4.73435619639862e-26,5521,2299,865,0.376250543714659,0.156674515486325,"TF:M13144_1","TF","Factor: ZNF138; motif: GCAGCRSCNSGSNCMGSGCS; match class: 1",20092,9759,"TF:M13144"
"query_1",TRUE,6.37299580956923e-26,6863,2299,1030,0.448020878642888,0.150080139880519,"TF:M12722_1","TF","Factor: ZXDL; motif: GSGSCNNGGGMRGCNCCGGGS; match class: 1",20092,11991,"TF:M12722"
"query_1",TRUE,1.69250456746034e-24,7920,2299,1150,0.500217485863419,0.14520202020202,"TF:M13366","TF","Factor: ZBED4; motif: CCCGCYCCGC",20092,9310,"TF:M00000"
"query_1",TRUE,4.34013913840211e-24,2621,2299,475,0.206611570247934,0.181228538725677,"TF:M12742","TF","Factor: ZNF93; motif: GGYAGCRGCAGCGGYG",20092,11914,"TF:M00000"
"query_1",TRUE,8.73312413079515e-24,13582,2299,1776,0.772509786863854,0.130761301722869,"TF:M00803","TF","Factor: E2F; motif: GGCGSG",20092,1590,"TF:M00000"
"query_1",TRUE,3.90349148200689e-23,13676,2299,1783,0.775554588951718,0.130374378473238,"TF:M11531","TF","Factor: E2F-2; motif: GCGCGCGCGYW",20092,1510,"TF:M00000"
"query_1",TRUE,3.94618475431171e-22,12804,2299,1687,0.733797303175294,0.13175570134333,"TF:M00333_1","TF","Factor: ZF5; motif: NRNGNGCGCGCWN; match class: 1",20092,9487,"TF:M00333"
"query_1",TRUE,5.32537876603324e-22,5989,2299,905,0.393649412788169,0.151110369009851,"TF:M13129_1","TF","Factor: RERE; motif: CNGCNSCNNGSRCRGSGSS; match class: 1",20092,7349,"TF:M13129"
"query_1",TRUE,6.67560794568658e-22,10892,2299,1478,0.642888212266203,0.135695923613661,"TF:M12722","TF","Factor: ZXDL; motif: GSGSCNNGGGMRGCNCCGGGS",20092,11990,"TF:M00000"
"query_1",TRUE,1.05073589410723e-21,8649,2299,1222,0.531535450195737,0.141288010174587,"TF:M13127_1","TF","Factor: HA95; motif: CCSNSSCCNSCNCCWSCCNS; match class: 1",20092,3433,"TF:M13127"
"query_1",TRUE,1.14818854240869e-21,6303,2299,942,0.409743366681166,0.149452641599238,"TF:M03896","TF","Factor: EGR1; motif: NACGCCCACGCANW",20092,1646,"TF:M00000"
"query_1",TRUE,2.82814304677918e-21,14532,2299,1863,0.810352327098739,0.128199834847234,"TF:M00716_1","TF","Factor: ZF5; motif: GSGCGCGR; match class: 1",20092,9475,"TF:M00716"
"query_1",TRUE,4.5826037451909e-21,4481,2299,711,0.309264897781644,0.158669939745593,"TF:M01199_1","TF","Factor: RNF96; motif: BCCCGCRGCC; match class: 1",20092,7495,"TF:M01199"
"query_1",TRUE,1.03565374789076e-20,10568,2299,1436,0.624619399739017,0.135881907645723,"TF:M04869_1","TF","Factor: Egr-1; motif: GCGCATGCG; match class: 1",20092,1651,"TF:M04869"
"query_1",TRUE,1.43073717487182e-20,7173,2299,1042,0.453240539364941,0.145266973372369,"TF:M12598_1","TF","Factor: E2F3; motif: NNRGMKGGAR; match class: 1",20092,1535,"TF:M12598"
"query_1",TRUE,2.06793490678098e-20,7928,2299,1131,0.491953023053502,0.14265893037336,"TF:M09826_1","TF","Factor: BTEB3; motif: CCNNSCCNSCCCCKCCCCC; match class: 1",20092,643,"TF:M09826"
"query_1",TRUE,5.69989983166223e-20,14371,2299,1841,0.800782949108308,0.128105211885046,"TF:M09894_1","TF","Factor: E2F-4; motif: SNGGGCGGGAANN; match class: 1",20092,1551,"TF:M09894"
"query_1",TRUE,9.61626950572954e-20,11205,2299,1502,0.653327533710309,0.134047300312361,"TF:M07206_1","TF","Factor: E2F-1; motif: NGGGCGGGARV; match class: 1",20092,1477,"TF:M07206"
"query_1",TRUE,2.01910385668163e-19,5847,2299,875,0.380600260983036,0.149649392851035,"TF:M01104_1","TF","Factor: MOVO-B; motif: GNGGGGG; match class: 1",20092,5405,"TF:M01104"
"query_1",TRUE,2.07791995113213e-19,3958,2299,636,0.276642018268813,0.160687215765538,"TF:M13366_1","TF","Factor: ZBED4; motif: CCCGCYCCGC; match class: 1",20092,9311,"TF:M13366"
"query_1",TRUE,5.54373188599021e-19,14924,2299,1893,0.823401478903871,0.126842669525596,"TF:M11529_1","TF","Factor: E2F-2; motif: GCGCGCGCNCS; match class: 1",20092,1507,"TF:M11529"
"query_1",TRUE,6.01885082150004e-19,10071,2299,1371,0.596346237494563,0.13613345248734,"TF:M02036","TF","Factor: WT1; motif: CGCCCCCNCN",20092,9224,"TF:M00000"
"query_1",TRUE,2.34850073397951e-18,10721,2299,1441,0.626794258373206,0.134409103628393,"TF:M00986_1","TF","Factor: Churchill; motif: CGGGNN; match class: 1",20092,855,"TF:M00986"
"query_1",TRUE,5.33899154761254e-18,6751,2299,978,0.425402348847325,0.144867427047845,"TF:M10108","TF","Factor: WT1; motif: RGGNGGGGGAGGRGGNGGRG",20092,9218,"TF:M00000"
"query_1",TRUE,8.10595841470347e-18,6817,2299,985,0.428447150935189,0.144491711896729,"TF:M13147_1","TF","Factor: ZNF253; motif: SNGNSCGNGGNGCKGNN; match class: 1",20092,10041,"TF:M13147"
"query_1",TRUE,1.44636379563159e-17,11579,2299,1532,0.666376685515441,0.132308489506866,"TF:M04869","TF","Factor: Egr-1; motif: GCGCATGCG",20092,1650,"TF:M00000"
"query_1",TRUE,1.83248282270789e-17,12603,2299,1643,0.714658547194432,0.130365785923986,"TF:M13127","TF","Factor: HA95; motif: CCSNSSCCNSCNCCWSCCNS",20092,3432,"TF:M00000"
"query_1",TRUE,1.8874025623696e-17,11376,2299,1509,0.656372335798173,0.132647679324895,"TF:M13147","TF","Factor: ZNF253; motif: SNGNSCGNGGNGCKGNN",20092,10040,"TF:M00000"
"query_1",TRUE,4.63386381037344e-17,9589,2299,1306,0.568073075250109,0.136197726561685,"TF:M10426","TF","Factor: ctcf; motif: CCRSCAGGGGGCGCN",20092,1172,"TF:M00000"
"query_1",TRUE,6.19072609265953e-17,8770,2299,1211,0.526750761200522,0.138084378563284,"TF:M01199","TF","Factor: RNF96; motif: BCCCGCRGCC",20092,7494,"TF:M00000"
"query_1",TRUE,7.63885175365432e-17,8089,2299,1131,0.491953023053502,0.139819507973792,"TF:M00982","TF","Factor: KROX; motif: CCCGCCCCCRCCCC",20092,4766,"TF:M00000"
"query_1",TRUE,8.90040615451802e-17,9367,2299,1279,0.556328838625489,0.136543183516601,"TF:M12703","TF","Factor: ZNF383; motif: SSNGGGMGGNGSNGGS",20092,10408,"TF:M00000"
"query_1",TRUE,1.11069755070629e-16,15301,2299,1921,0.835580687255328,0.125547349846415,"TF:M10438_1","TF","Factor: ZF5; motif: GGSGCGCGS; match class: 1",20092,9479,"TF:M10438"
"query_1",TRUE,1.53897007758528e-16,13603,2299,1745,0.759025663331883,0.128280526354481,"TF:M01240_1","TF","Factor: BEN; motif: CAGCGRNV; match class: 1",20092,513,"TF:M01240"
"query_1",TRUE,1.69451800402779e-16,10401,2299,1395,0.606785558938669,0.134121719065474,"TF:M13129","TF","Factor: RERE; motif: CNGCNSCNNGSRCRGSGSS",20092,7348,"TF:M00000"
"query_1",TRUE,3.26958200041733e-16,9386,2299,1278,0.555893866898652,0.136160238653313,"TF:M08911","TF","Factor: CTCF; motif: NCCRSTAGGGGGCGC",20092,1162,"TF:M00000"
"query_1",TRUE,6.16513111681954e-16,9452,2299,1284,0.558503697259678,0.13584426576386,"TF:M01857","TF","Factor: AP-2alpha; motif: NGCCYSNNGSN",20092,138,"TF:M00000"
"query_1",TRUE,6.29667154560647e-16,8167,2299,1135,0.493692909960853,0.13897391943186,"TF:M07354","TF","Factor: Egr-1; motif: GCGGGGGCGG",20092,1672,"TF:M00000"
"query_1",TRUE,6.47416735721158e-16,4524,2299,692,0.301000434971727,0.152961980548187,"TF:M10426_1","TF","Factor: ctcf; motif: CCRSCAGGGGGCGCN; match class: 1",20092,1173,"TF:M10426"
"query_1",TRUE,7.26738009433574e-16,8358,2299,1157,0.503262287951283,0.138430246470447,"TF:M12351_1","TF","Factor: TIEG1; motif: NCCCNSNCCCCGCCCCC; match class: 1",20092,9013,"TF:M12351"
"query_1",TRUE,7.8173116635723e-16,5616,2299,828,0.360156589821662,0.147435897435897,"TF:M07084_1","TF","Factor: E2F-4; motif: NGGCGGGAARN; match class: 1",20092,1549,"TF:M07084"
"query_1",TRUE,8.10459693175445e-16,7739,2299,1084,0.471509351892127,0.140069776456907,"TF:M08878","TF","Factor: EGR; motif: CGCCCCCGCNN",20092,1712,"TF:M00000"
"query_1",TRUE,9.21143442527948e-16,10580,2299,1411,0.613745106568073,0.133364839319471,"TF:M01104","TF","Factor: MOVO-B; motif: GNGGGGG",20092,5404,"TF:M00000"
"query_1",TRUE,9.8719155412019e-16,11988,2299,1567,0.681600695954763,0.130714047380714,"TF:M09826","TF","Factor: BTEB3; motif: CCNNSCCNSCCCCKCCCCC",20092,642,"TF:M00000"
"query_1",TRUE,9.96185603422732e-16,6621,2299,950,0.413223140495868,0.143482857574385,"TF:M12508","TF","Factor: EGR1; motif: NNMCGCCCACGCNN",20092,1670,"TF:M00000"
"query_1",TRUE,1.11004475336483e-15,9395,2299,1276,0.555023923444976,0.135816923895689,"TF:M03876_1","TF","Factor: Kaiso; motif: GCMGGGRGCRGS; match class: 1",20092,4679,"TF:M03876"
"query_1",TRUE,1.18093130218228e-15,8557,2299,1179,0.512831665941714,0.137781932920416,"TF:M03893","TF","Factor: WT1; motif: GNGGGGGCGGGG",20092,9226,"TF:M00000"
"query_1",TRUE,1.95121060290142e-15,10757,2299,1429,0.621574597651153,0.132843729664405,"TF:M08205_1","TF","Factor: E2F-1:Elk-1; motif: SGCGCSNNAMCGGAAGT; match class: 1",20092,1465,"TF:M08205"
"query_1",TRUE,2.19751657303436e-15,11055,2299,1462,0.635928664636799,0.132247851650837,"TF:M07250","TF","Factor: E2F-1; motif: NNNSSCGCSAANN",20092,1490,"TF:M00000"
"query_1",TRUE,3.21259821140832e-15,5497,2299,810,0.352327098738582,0.147353101691832,"TF:M02036_1","TF","Factor: WT1; motif: CGCCCCCNCN; match class: 1",20092,9225,"TF:M02036"
"query_1",TRUE,3.32323482660854e-15,9690,2299,1307,0.568508046976946,0.134881320949432,"TF:M02089_1","TF","Factor: E2F-3; motif: GGCGGGN; match class: 1",20092,1537,"TF:M02089"
"query_1",TRUE,3.96025787184302e-15,10337,2299,1380,0.600260983036103,0.133501015768598,"TF:M08867","TF","Factor: AP2; motif: GCCYGSGGSN",20092,156,"TF:M00000"
"query_1",TRUE,4.10927992089969e-15,15500,2299,1934,0.841235319704219,0.124774193548387,"TF:M00333","TF","Factor: ZF5; motif: NRNGNGCGCGCWN",20092,9486,"TF:M00000"
"query_1",TRUE,5.59092220681914e-15,8522,2299,1171,0.509351892127012,0.13740905890636,"TF:M10026","TF","Factor: PATZ; motif: GGGGNGGGGGMKGGRRNGGNRN",20092,6500,"TF:M00000"
"query_1",TRUE,7.06506907639821e-15,9593,2299,1294,0.562853414528056,0.134890023975816,"TF:M10432","TF","Factor: MAZ; motif: GGGMGGGGS",20092,5150,"TF:M00000"
"query_1",TRUE,7.69169204520023e-15,11416,2299,1499,0.652022618529796,0.131306937631395,"TF:M11601_1","TF","Factor: TCF-1; motif: ACATCGRGRCGCTGW; match class: 1",20092,8629,"TF:M11601"
"query_1",TRUE,9.53738277674562e-15,6402,2299,918,0.39930404523706,0.143392689784442,"TF:M07208","TF","Factor: EGR1; motif: NCNCCGCCCCCGCN",20092,1656,"TF:M00000"
"query_1",TRUE,1.0883918594874e-14,10858,2299,1436,0.624619399739017,0.132252716890772,"TF:M10072","TF","Factor: sp4; motif: NNGNARGRGGCGGRGCNNRR",20092,8110,"TF:M00000"
"query_1",TRUE,2.51389731510411e-14,14521,2299,1830,0.795998260113093,0.12602437848633,"TF:M09636_1","TF","Factor: MAZ; motif: GGGMGGGGSSGGGGGGGGGGGG; match class: 1",20092,5147,"TF:M09636"
"query_1",TRUE,2.73614643460196e-14,9475,2299,1277,0.555458895171814,0.134775725593668,"TF:M09892_1","TF","Factor: E2F-1; motif: NNNNGGCGGGAARN; match class: 1",20092,1479,"TF:M09892"
"query_1",TRUE,3.88857354993546e-14,7030,2299,990,0.430622009569378,0.140825035561878,"TF:M01219","TF","Factor: SP1:SP3; motif: CCSCCCCCYCC",20092,8036,"TF:M00000"
"query_1",TRUE,5.11133571430267e-14,11189,2299,1469,0.638973466724663,0.131289659486996,"TF:M07084","TF","Factor: E2F-4; motif: NGGCGGGAARN",20092,1548,"TF:M00000"
"query_1",TRUE,6.03118117228622e-14,14434,2299,1819,0.791213571117877,0.126021892753222,"TF:M12597","TF","Factor: E2F1; motif: GSGCGGGAAN",20092,1482,"TF:M00000"
"query_1",TRUE,6.57777331371524e-14,10926,2299,1439,0.62592431491953,0.131704191835988,"TF:M00189","TF","Factor: AP-2; motif: MKCCCSCNGGCG",20092,158,"TF:M00000"
"query_1",TRUE,8.44654786048119e-14,8103,2299,1115,0.484993475424097,0.137603356781439,"TF:M04823_1","TF","Factor: E2F-4; motif: NNTTCCCGCCNN; match class: 1",20092,1547,"TF:M04823"
"query_1",TRUE,1.1687056430136e-13,6945,2299,977,0.424967377120487,0.140676745860331,"TF:M01873","TF","Factor: Egr-1; motif: GCGGGGGCGG",20092,1674,"TF:M00000"
"query_1",TRUE,1.46173139529549e-13,8449,2299,1154,0.50195737277077,0.136584211149248,"TF:M13124_1","TF","Factor: ZNF670; motif: SNGGGCRGRG; match class: 1",20092,11253,"TF:M13124"
"query_1",TRUE,3.05580475014492e-13,11763,2299,1528,0.66463679860809,0.129898835331123,"TF:M11882_1","TF","Factor: pax-6; motif: NYACGCNYSANYGMNCN; match class: 1",20092,6597,"TF:M11882"
"query_1",TRUE,3.55080575559535e-13,6271,2299,893,0.388429752066116,0.142401530856323,"TF:M00189_1","TF","Factor: AP-2; motif: MKCCCSCNGGCG; match class: 1",20092,159,"TF:M00189"
"query_1",TRUE,4.18940458847601e-13,8783,2299,1190,0.517616354936929,0.135489012865763,"TF:M10071","TF","Factor: Sp1; motif: NGGGGGCGGGGCCNGGGGGGGG",20092,8052,"TF:M00000"
"query_1",TRUE,4.86770253194907e-13,1335,2299,252,0.109612875163114,0.18876404494382,"TF:M12742_1","TF","Factor: ZNF93; motif: GGYAGCRGCAGCGGYG; match class: 1",20092,11915,"TF:M12742"
"query_1",TRUE,4.99628091490498e-13,10192,2299,1351,0.587646802957808,0.132554945054945,"TF:M12597_1","TF","Factor: E2F1; motif: GSGCGGGAAN; match class: 1",20092,1483,"TF:M12597"
"query_1",TRUE,5.83910391158142e-13,12609,2299,1619,0.704219225750326,0.128400348957094,"TF:M12351","TF","Factor: TIEG1; motif: NCCCNSNCCCCGCCCCC",20092,9012,"TF:M00000"
"query_1",TRUE,6.13447329601627e-13,3789,2299,583,0.253588516746411,0.153866455529163,"TF:M07354_1","TF","Factor: Egr-1; motif: GCGGGGGCGG; match class: 1",20092,1673,"TF:M07354"
"query_1",TRUE,7.74630047628481e-13,13581,2299,1723,0.749456285341453,0.12686841911494,"TF:M02089","TF","Factor: E2F-3; motif: GGCGGGN",20092,1536,"TF:M00000"
"query_1",TRUE,9.43829421481479e-13,13943,2299,1761,0.765985210961287,0.126299935451481,"TF:M09892","TF","Factor: E2F-1; motif: NNNNGGCGGGAARN",20092,1478,"TF:M00000"
"query_1",TRUE,9.66727800728356e-13,4754,2299,704,0.30622009569378,0.148085822465292,"TF:M01857_1","TF","Factor: AP-2alpha; motif: NGCCYSNNGSN; match class: 1",20092,139,"TF:M01857"
"query_1",TRUE,1.02626585643744e-12,16523,2299,2025,0.880817746846455,0.122556436482479,"TF:M00716","TF","Factor: ZF5; motif: GSGCGCGR",20092,9474,"TF:M00000"
"query_1",TRUE,1.04387646751741e-12,6826,2299,957,0.416267942583732,0.140199238206856,"TF:M13149_1","TF","Factor: ZNF219; motif: SNNCAGCACCNNGGNCAGCGSC; match class: 1",20092,9923,"TF:M13149"
"query_1",TRUE,1.21643957999023e-12,10337,2299,1365,0.593736407133536,0.132049917771113,"TF:M09723","TF","Factor: BTEB1; motif: GGGGGCGGGGCNGSGGGNGS",20092,628,"TF:M00000"
"query_1",TRUE,1.34521100860316e-12,15421,2299,1914,0.832535885167464,0.124116464561312,"TF:M08526_1","TF","Factor: E2F-3:HES-7; motif: NNNSGCGCSNNNNNCRCGYGNN; match class: 1",20092,1521,"TF:M08526"
"query_1",TRUE,1.47269347884265e-12,4087,2299,619,0.269247498912571,0.151455835576217,"TF:M10086_1","TF","Factor: TAFII250; motif: RARRWGGCGGMGGNGR; match class: 1",20092,8393,"TF:M10086"
"query_1",TRUE,1.5790529642912e-12,2958,2299,473,0.205741626794258,0.159905341446924,"TF:M10108_1","TF","Factor: WT1; motif: RGGNGGGGGAGGRGGNGGRG; match class: 1",20092,9219,"TF:M10108"
"query_1",TRUE,1.6081942418595e-12,10583,2299,1392,0.605480643758156,0.131531701785883,"TF:M00196","TF","Factor: Sp1; motif: NGGGGGCGGGGYN",20092,8070,"TF:M00000"
"query_1",TRUE,1.67097969211777e-12,7661,2299,1055,0.458895171813832,0.137710481660358,"TF:M01858","TF","Factor: AP-2beta; motif: GCNNNGGSCNGVGGGN",20092,140,"TF:M00000"
"query_1",TRUE,1.83787997899302e-12,3220,2299,507,0.220530665506742,0.157453416149068,"TF:M12697","TF","Factor: ZNF142; motif: SNSCGCCCGCCCGCSCSS",20092,9772,"TF:M00000"
"query_1",TRUE,1.93409630942282e-12,10623,2299,1396,0.607220530665507,0.131412971853525,"TF:M00931","TF","Factor: Sp1; motif: GGGGCGGGGC",20092,8072,"TF:M00000"
"query_1",TRUE,2.00806535392509e-12,6102,2299,868,0.377555458895172,0.142248443133399,"TF:M12227_1","TF","Factor: ZIC4; motif: NNCCNCCCRYNGYGN; match class: 1",20092,9633,"TF:M12227"
"query_1",TRUE,3.1256746590719e-12,2772,2299,447,0.194432361896477,0.161255411255411,"TF:M01873_1","TF","Factor: Egr-1; motif: GCGGGGGCGG; match class: 1",20092,1675,"TF:M01873"
"query_1",TRUE,4.62610316210381e-12,8702,2299,1174,0.510656807307525,0.134911514594346,"TF:M03807","TF","Factor: SP2; motif: GNNGGGGGCGGGGSN",20092,8096,"TF:M00000"
"query_1",TRUE,5.85868384496438e-12,3650,2299,560,0.243584167029143,0.153424657534247,"TF:M00982_1","TF","Factor: KROX; motif: CCCGCCCCCRCCCC; match class: 1",20092,4767,"TF:M00982"
"query_1",TRUE,6.87057278854506e-12,12815,2299,1635,0.71117877337973,0.127584861490441,"TF:M12598","TF","Factor: E2F3; motif: NNRGMKGGAR",20092,1534,"TF:M00000"
"query_1",TRUE,8.57091735172532e-12,14860,2299,1852,0.805567638103523,0.124629878869448,"TF:M08205","TF","Factor: E2F-1:Elk-1; motif: SGCGCSNNAMCGGAAGT",20092,1464,"TF:M00000"
"query_1",TRUE,8.79273353327115e-12,16718,2299,2040,0.887342322749021,0.122024165570044,"TF:M11529","TF","Factor: E2F-2; motif: GCGCGCGCNCS",20092,1506,"TF:M00000"
"query_1",TRUE,9.26797732091111e-12,14603,2299,1825,0.793823401478904,0.124974320345135,"TF:M00986","TF","Factor: Churchill; motif: CGGGNN",20092,854,"TF:M00000"
"query_1",TRUE,9.48238665055139e-12,5774,2299,824,0.358416702914311,0.142708694146172,"TF:M09984_1","TF","Factor: MAZ; motif: GGGGGAGGGGGNGRGRRRGNRG; match class: 1",20092,5149,"TF:M09984"
"query_1",TRUE,9.53807491741865e-12,13137,2299,1669,0.725967812092214,0.127045748648854,"TF:M04823","TF","Factor: E2F-4; motif: NNTTCCCGCCNN",20092,1546,"TF:M00000"
"query_1",TRUE,9.97202147705914e-12,5326,2299,769,0.334493257938234,0.144386030792339,"TF:M08867_1","TF","Factor: AP2; motif: GCCYGSGGSN; match class: 1",20092,157,"TF:M08867"
"query_1",TRUE,1.11689546994556e-11,16348,2299,2003,0.871248368856024,0.12252263273795,"TF:M11018_1","TF","Factor: IRX-1; motif: NACRYNNNNNNNNRYGNN; match class: 1",20092,4529,"TF:M11018"
"query_1",TRUE,1.65162861623222e-11,16106,2299,1978,0.86037407568508,0.12281137464299,"TF:M12599_1","TF","Factor: E2F4; motif: YCCCGCCNCNNSSNNSNN; match class: 1",20092,1555,"TF:M12599"
"query_1",TRUE,2.09944798876877e-11,9861,2299,1303,0.566768160069596,0.132136700131832,"TF:M09984","TF","Factor: MAZ; motif: GGGGGAGGGGGNGRGRRRGNRG",20092,5148,"TF:M00000"
"query_1",TRUE,2.15728112529269e-11,7046,2299,975,0.424097433666812,0.138376383763838,"TF:M01118","TF","Factor: WT1; motif: SMCNCCNSC",20092,9222,"TF:M00000"
"query_1",TRUE,2.49824907770325e-11,13560,2299,1712,0.744671596346237,0.126253687315634,"TF:M11603_1","TF","Factor: TCF-1; motif: ACATCGRGRCGCTGW; match class: 1",20092,8633,"TF:M11603"
"query_1",TRUE,3.22227151354973e-11,6205,2299,873,0.379730317529361,0.140692989524577,"TF:M09723_1","TF","Factor: BTEB1; motif: GGGGGCGGGGCNGSGGGNGS; match class: 1",20092,629,"TF:M09723"
"query_1",TRUE,3.95370480416603e-11,4126,2299,616,0.267942583732057,0.149297140087252,"TF:M03893_1","TF","Factor: WT1; motif: GNGGGGGCGGGG; match class: 1",20092,9227,"TF:M03893"
"query_1",TRUE,4.13833902882249e-11,10993,2299,1429,0.621574597651153,0.129991812971891,"TF:M07395","TF","Factor: Sp1; motif: NGGGGCGGGGN",20092,8064,"TF:M00000"
"query_1",TRUE,4.42552087309367e-11,3329,2299,514,0.223575467594606,0.154400720937218,"TF:M08878_1","TF","Factor: EGR; motif: CGCCCCCGCNN; match class: 1",20092,1713,"TF:M08878"
"query_1",TRUE,4.64086088255867e-11,9070,2299,1210,0.526315789473684,0.133406835722161,"TF:M08487_1","TF","Factor: GCMa:Erg; motif: ATGCGGGCGGAARKG; match class: 1",20092,3159,"TF:M08487"
"query_1",TRUE,5.40628665366187e-11,3055,2299,478,0.207916485428447,0.156464811783961,"TF:M01219_1","TF","Factor: SP1:SP3; motif: CCSCCCCCYCC; match class: 1",20092,8037,"TF:M01219"
"query_1",TRUE,5.4717000534401e-11,6383,2299,893,0.388429752066116,0.139902866990443,"TF:M06948_1","TF","Factor: Sp2; motif: TGGGCGCGCCCA; match class: 1",20092,8081,"TF:M06948"
"query_1",TRUE,6.0752448536715e-11,5692,2299,809,0.351892127011744,0.142129304286718,"TF:M07250_1","TF","Factor: E2F-1; motif: NNNSSCGCSAANN; match class: 1",20092,1491,"TF:M07250"
"query_1",TRUE,6.10986157086258e-11,16645,2299,2029,0.882557633753806,0.121898468008411,"TF:M09894","TF","Factor: E2F-4; motif: SNGGGCGGGAANN",20092,1550,"TF:M00000"
"query_1",TRUE,7.4704819464631e-11,4091,2299,610,0.265332753371031,0.149107797604498,"TF:M08911_1","TF","Factor: CTCF; motif: NCCRSTAGGGGGCGC; match class: 1",20092,1163,"TF:M08911"
"query_1",TRUE,7.78769486014767e-11,4394,2299,648,0.281861678990866,0.147473827947201,"TF:M00800_1","TF","Factor: AP-2; motif: GSCCSCRGGCNRNRNN; match class: 1",20092,155,"TF:M00800"
"query_1",TRUE,8.47189911816881e-11,7959,2299,1079,0.469334493257938,0.135569795200402,"TF:M03567","TF","Factor: Sp2; motif: NYSGCCCCGCCCCCY",20092,8094,"TF:M00000"
"query_1",TRUE,8.67245667637926e-11,6021,2299,848,0.368856024358417,0.140840391961468,"TF:M10107","TF","Factor: DB1; motif: GGRRRRGRRGGAGGGGGNGRRR",20092,1226,"TF:M00000"
"query_1",TRUE,9.17801969999455e-11,8966,2299,1196,0.520226185297956,0.133392817309837,"TF:M10112","TF","Factor: Miz-1; motif: NNRGGWGGGGGAGGGGMRR",20092,5362,"TF:M00000"
"query_1",TRUE,9.39365678906677e-11,16908,2299,2054,0.89343192692475,0.121480955760587,"TF:M01240","TF","Factor: BEN; motif: CAGCGRNV",20092,512,"TF:M00000"
"query_1",TRUE,1.02651863963844e-10,7058,2299,972,0.422792518486298,0.137716066874469,"TF:M07329","TF","Factor: Osx; motif: CCNCCCCCNNN",20092,6400,"TF:M00000"
"query_1",TRUE,1.06000818504576e-10,9143,2299,1216,0.528925619834711,0.13299792190747,"TF:M06948","TF","Factor: Sp2; motif: TGGGCGCGCCCA",20092,8080,"TF:M00000"
"query_1",TRUE,1.07883865510036e-10,6557,2299,912,0.396694214876033,0.13908799755986,"TF:M13146","TF","Factor: ZNF232; motif: NCAGCASCNNGGNCAGCGCC",20092,9986,"TF:M00000"
"query_1",TRUE,1.09932451292919e-10,4505,2299,661,0.287516311439756,0.146725860155383,"TF:M12703_1","TF","Factor: ZNF383; motif: SSNGGGMGGNGSNGGS; match class: 1",20092,10409,"TF:M12703"
"query_1",TRUE,1.22884550992612e-10,4220,2299,625,0.271857329273597,0.148104265402844,"TF:M10112_1","TF","Factor: Miz-1; motif: NNRGGWGGGGGAGGGGMRR; match class: 1",20092,5363,"TF:M10112"
"query_1",TRUE,1.30905938725384e-10,15697,2299,1932,0.840365376250544,0.123080843473275,"TF:M08525_1","TF","Factor: E2F-1:HES-7; motif: GGCRCGTGSYNNWNGGCGCSM; match class: 1",20092,1471,"TF:M08525"
"query_1",TRUE,1.64194551429707e-10,6467,2299,900,0.39147455415398,0.139168084119375,"TF:M10072_1","TF","Factor: sp4; motif: NNGNARGRGGCGGRGCNNRR; match class: 1",20092,8111,"TF:M10072"
"query_1",TRUE,2.30630586399651e-10,10019,2299,1314,0.571552849064811,0.131150813454437,"TF:M00933","TF","Factor: Sp1; motif: CCCCGCCCCN",20092,8062,"TF:M00000"
"query_1",TRUE,2.36337472249548e-10,9381,2299,1241,0.539799913005655,0.132288668585439,"TF:M00800","TF","Factor: AP-2; motif: GSCCSCRGGCNRNRNN",20092,154,"TF:M00000"
"query_1",TRUE,3.42684579081783e-10,6593,2299,913,0.397129186602871,0.138480206279387,"TF:M02090_1","TF","Factor: E2F-4; motif: GCGGGAAANA; match class: 1",20092,1559,"TF:M02090"
"query_1",TRUE,3.67880604475865e-10,4990,2299,718,0.312309699869508,0.143887775551102,"TF:M10026_1","TF","Factor: PATZ; motif: GGGGNGGGGGMKGGRRNGGNRN; match class: 1",20092,6501,"TF:M10026"
"query_1",TRUE,5.12229574069341e-10,10172,2299,1329,0.578077424967377,0.130652772316162,"TF:M01865","TF","Factor: BTEB3; motif: BNRNGGGAGGNGT",20092,652,"TF:M00000"
"query_1",TRUE,5.30213827844133e-10,13385,2299,1685,0.732927359721618,0.125887187149795,"TF:M07380","TF","Factor: E2F-4; motif: NTTTCSCGCC",20092,1556,"TF:M00000"
"query_1",TRUE,5.3957956819185e-10,10766,2299,1396,0.607220530665507,0.129667471670072,"TF:M00932","TF","Factor: Sp1; motif: NNGGGGCGGGGNN",20092,8068,"TF:M00000"
"query_1",TRUE,7.96381243892489e-10,11222,2299,1446,0.628969117007395,0.128854036713598,"TF:M04950","TF","Factor: Egr-1; motif: NGCGTGCGY",20092,1654,"TF:M00000"
"query_1",TRUE,1.13799554081357e-09,14141,2299,1764,0.767290126141801,0.124743653206987,"TF:M04106","TF","Factor: RUNX2; motif: NRACCGCAAACCGCAN",20092,7560,"TF:M00000"
"query_1",TRUE,1.20674840889086e-09,3250,2299,496,0.215745976511527,0.152615384615385,"TF:M01858_1","TF","Factor: AP-2beta; motif: GCNNNGGSCNGVGGGN; match class: 1",20092,141,"TF:M01858"
"query_1",TRUE,1.28712446148227e-09,2575,2299,408,0.177468464549804,0.158446601941748,"TF:M10134","TF","Factor: FPM315; motif: GGGAGGAGGRRGRGGRGGRR",20092,2928,"TF:M00000"
"query_1",TRUE,1.85923579312915e-09,11397,2299,1463,0.636363636363636,0.128367114152847,"TF:M12227","TF","Factor: ZIC4; motif: NNCCNCCCRYNGYGN",20092,9632,"TF:M00000"
"query_1",TRUE,1.87607029311907e-09,14996,2299,1853,0.806002609830361,0.123566284342491,"TF:M07206","TF","Factor: E2F-1; motif: NGGGCGGGARV",20092,1476,"TF:M00000"
"query_1",TRUE,2.07207440333733e-09,6721,2299,923,0.401478903871248,0.137330754352031,"TF:M07436","TF","Factor: WT1; motif: NNGGGNGGGSGN",20092,9220,"TF:M00000"
"query_1",TRUE,2.12831415834177e-09,11715,2299,1498,0.651587646802958,0.127870251813914,"TF:M13149","TF","Factor: ZNF219; motif: SNNCAGCACCNNGGNCAGCGSC",20092,9922,"TF:M00000"
"query_1",TRUE,2.13028082487437e-09,8953,2299,1185,0.51544149630274,0.13235786887077,"TF:M04953","TF","Factor: Sp1; motif: GGNDGGRGGCGGGG",20092,8046,"TF:M00000"
"query_1",TRUE,2.20908407563042e-09,15000,2299,1853,0.806002609830361,0.123533333333333,"TF:M11530","TF","Factor: E2F-2; motif: NWTTTGGCGCCAWWNN",20092,1508,"TF:M00000"
"query_1",TRUE,2.86864251388648e-09,6939,2299,948,0.412353197042192,0.136619109381755,"TF:M12590_1","TF","Factor: CP2; motif: NRRRCCGGCYNRARCCGGNN; match class: 1",20092,8889,"TF:M12590"
